{
  "schemaVersion": 1,
  "eventId": "00000000-0000-4000-8000-000000000080",
  "tenantScope": {
    "scopeType": "project",
    "organizationId": "00000000-0000-4000-8000-000000000001",
    "workspaceId": "00000000-0000-4000-8000-000000000002",
    "projectId": "00000000-0000-4000-8000-000000000003"
  },
  "datasetVersionId": "00000000-0000-4000-8000-000000000081",
  "dashboardVersionId": "00000000-0000-4000-8000-000000000082",
  "templateId": "STARTER_KPI_TABLE_V1",
  "aiUsed": false,
  "occurredAt": "2026-08-12T10:00:00.000Z"
}
